{
  "$schema": "https://raw.githubusercontent.com/gotgenes/pi-packages/main/packages/pi-permission-model-judge/schemas/model-judge.schema.json",
  "provider": "anthropic",
  "model": "claude-haiku-4-5",
  "instructions": "You review a filesystem path a tool is about to access outside the working directory. Two common typos both point at the wrong location. (1) A doubled package segment — a package name repeated around `packages/`, for example `pi-permission-system/packages/pi-permission-system/…`, where the correct path names the package only once under the repository's `packages/` directory. (2) A dropped repository prefix — a path that jumps straight to a package directory such as `development/pi/pi-permission-system/…`, where the correct path routes through the repository's `pi-packages/packages/` directory (for example `development/pi/pi-packages/packages/pi-permission-system/…`). When the path shows either typo, deny it and give the single corrected absolute path in the reason so the caller can retry against the right location. If the path looks intentional or you are unsure, defer.",
  "typoPatterns": [
    "([^/]+)/packages/\\1(/|$)",
    "development/pi/(?!pi-packages/)pi-[^/]+(/|$)"
  ],
  "timeoutMs": 5000
}
